{
  "$schema": "https://www.designtokens.org/schemas/2025.10/format.json",
  "primitive": {
    "color": {
      "aegean": {
        "50": {
          "$type": "color",
          "$value": {
            "colorSpace": "srgb",
            "components": [0.882353, 0.964706, 1],
            "alpha": 1,
            "hex": "#E1F6FF"
          }
        },
        "100": {
          "$type": "color",
          "$value": {
            "colorSpace": "srgb",
            "components": [0.792157, 0.917647, 0.980392],
            "alpha": 1,
            "hex": "#CAEAFA"
          }
        },
        "200": {
          "$type": "color",
          "$value": {
            "colorSpace": "srgb",
            "components": [0.627451, 0.843137, 0.956863],
            "alpha": 1,
            "hex": "#A0D7F4"
          }
        },
        "300": {
          "$type": "color",
          "$value": {
            "colorSpace": "srgb",
            "components": [0.454902, 0.74902, 0.909804],
            "alpha": 1,
            "hex": "#74BFE8"
          }
        },
        "400": {
          "$type": "color",
          "$value": {
            "colorSpace": "srgb",
            "components": [0.301961, 0.65098, 0.839216],
            "alpha": 1,
            "hex": "#4DA6D6"
          }
        },
        "500": {
          "$type": "color",
          "$value": {
            "colorSpace": "srgb",
            "components": [0.156863, 0.564706, 0.768627],
            "alpha": 1,
            "hex": "#2890C4"
          }
        },
        "600": {
          "$type": "color",
          "$value": {
            "colorSpace": "srgb",
            "components": [0, 0.482353, 0.682353],
            "alpha": 1,
            "hex": "#007BAE"
          }
        },
        "700": {
          "$type": "color",
          "$value": {
            "colorSpace": "srgb",
            "components": [0, 0.403922, 0.6],
            "alpha": 1,
            "hex": "#006799"
          }
        },
        "800": {
          "$type": "color",
          "$value": {
            "colorSpace": "srgb",
            "components": [0.007843, 0.329412, 0.498039],
            "alpha": 1,
            "hex": "#02547F"
          }
        },
        "900": {
          "$type": "color",
          "$value": {
            "colorSpace": "srgb",
            "components": [0.027451, 0.243137, 0.372549],
            "alpha": 1,
            "hex": "#073E5F"
          }
        },
        "950": {
          "$type": "color",
          "$value": {
            "colorSpace": "srgb",
            "components": [0.039216, 0.160784, 0.247059],
            "alpha": 1,
            "hex": "#0A293F"
          }
        }
      },
      "neutral": {
        "0": {
          "$type": "color",
          "$value": {
            "colorSpace": "srgb",
            "components": [1, 1, 1],
            "alpha": 1,
            "hex": "#FFFFFF"
          }
        },
        "25": {
          "$type": "color",
          "$value": {
            "colorSpace": "srgb",
            "components": [0.984314, 0.992157, 0.996078],
            "alpha": 1,
            "hex": "#FBFDFE"
          }
        },
        "50": {
          "$type": "color",
          "$value": {
            "colorSpace": "srgb",
            "components": [0.956863, 0.968627, 0.976471],
            "alpha": 1,
            "hex": "#F4F7F9"
          }
        },
        "100": {
          "$type": "color",
          "$value": {
            "colorSpace": "srgb",
            "components": [0.921569, 0.937255, 0.94902],
            "alpha": 1,
            "hex": "#EBEFF2"
          }
        },
        "200": {
          "$type": "color",
          "$value": {
            "colorSpace": "srgb",
            "components": [0.85098, 0.87451, 0.890196],
            "alpha": 1,
            "hex": "#D9DFE3"
          }
        },
        "300": {
          "$type": "color",
          "$value": {
            "colorSpace": "srgb",
            "components": [0.756863, 0.788235, 0.807843],
            "alpha": 1,
            "hex": "#C1C9CE"
          }
        },
        "400": {
          "$type": "color",
          "$value": {
            "colorSpace": "srgb",
            "components": [0.615686, 0.65098, 0.678431],
            "alpha": 1,
            "hex": "#9DA6AD"
          }
        },
        "500": {
          "$type": "color",
          "$value": {
            "colorSpace": "srgb",
            "components": [0.490196, 0.533333, 0.564706],
            "alpha": 1,
            "hex": "#7D8890"
          }
        },
        "600": {
          "$type": "color",
          "$value": {
            "colorSpace": "srgb",
            "components": [0.376471, 0.419608, 0.447059],
            "alpha": 1,
            "hex": "#606B72"
          }
        },
        "700": {
          "$type": "color",
          "$value": {
            "colorSpace": "srgb",
            "components": [0.290196, 0.329412, 0.360784],
            "alpha": 1,
            "hex": "#4A545C"
          }
        },
        "800": {
          "$type": "color",
          "$value": {
            "colorSpace": "srgb",
            "components": [0.207843, 0.239216, 0.266667],
            "alpha": 1,
            "hex": "#353D44"
          }
        },
        "900": {
          "$type": "color",
          "$value": {
            "colorSpace": "srgb",
            "components": [0.141176, 0.164706, 0.192157],
            "alpha": 1,
            "hex": "#242A31"
          }
        },
        "950": {
          "$type": "color",
          "$value": {
            "colorSpace": "srgb",
            "components": [0.086275, 0.105882, 0.12549],
            "alpha": 1,
            "hex": "#161B20"
          }
        }
      },
      "success": {
        "tint": {
          "$type": "color",
          "$value": {
            "colorSpace": "srgb",
            "components": [0.909804, 0.968627, 0.937255],
            "alpha": 1,
            "hex": "#E8F7EF"
          }
        },
        "primary": {
          "$type": "color",
          "$value": {
            "colorSpace": "srgb",
            "components": [0.141176, 0.478431, 0.321569],
            "alpha": 1,
            "hex": "#247A52"
          }
        },
        "strong": {
          "$type": "color",
          "$value": {
            "colorSpace": "srgb",
            "components": [0.105882, 0.396078, 0.258824],
            "alpha": 1,
            "hex": "#1B6542"
          }
        }
      },
      "warning": {
        "tint": {
          "$type": "color",
          "$value": {
            "colorSpace": "srgb",
            "components": [1, 0.956863, 0.839216],
            "alpha": 1,
            "hex": "#FFF4D6"
          }
        },
        "primary": {
          "$type": "color",
          "$value": {
            "colorSpace": "srgb",
            "components": [0.592157, 0.388235, 0],
            "alpha": 1,
            "hex": "#976300"
          }
        },
        "strong": {
          "$type": "color",
          "$value": {
            "colorSpace": "srgb",
            "components": [0.486275, 0.313725, 0],
            "alpha": 1,
            "hex": "#7C5000"
          }
        }
      },
      "danger": {
        "tint": {
          "$type": "color",
          "$value": {
            "colorSpace": "srgb",
            "components": [0.992157, 0.92549, 0.937255],
            "alpha": 1,
            "hex": "#FDECEF"
          }
        },
        "primary": {
          "$type": "color",
          "$value": {
            "colorSpace": "srgb",
            "components": [0.721569, 0.227451, 0.294118],
            "alpha": 1,
            "hex": "#B83A4B"
          }
        },
        "strong": {
          "$type": "color",
          "$value": {
            "colorSpace": "srgb",
            "components": [0.596078, 0.172549, 0.235294],
            "alpha": 1,
            "hex": "#982C3C"
          }
        }
      }
    },
    "space": {
      "0": {
        "$type": "dimension",
        "$value": {
          "value": 0,
          "unit": "px"
        }
      },
      "1": {
        "$type": "dimension",
        "$value": {
          "value": 4,
          "unit": "px"
        }
      },
      "2": {
        "$type": "dimension",
        "$value": {
          "value": 8,
          "unit": "px"
        }
      },
      "3": {
        "$type": "dimension",
        "$value": {
          "value": 12,
          "unit": "px"
        }
      },
      "4": {
        "$type": "dimension",
        "$value": {
          "value": 16,
          "unit": "px"
        }
      },
      "5": {
        "$type": "dimension",
        "$value": {
          "value": 20,
          "unit": "px"
        }
      },
      "6": {
        "$type": "dimension",
        "$value": {
          "value": 24,
          "unit": "px"
        }
      },
      "8": {
        "$type": "dimension",
        "$value": {
          "value": 32,
          "unit": "px"
        }
      },
      "10": {
        "$type": "dimension",
        "$value": {
          "value": 40,
          "unit": "px"
        }
      },
      "12": {
        "$type": "dimension",
        "$value": {
          "value": 48,
          "unit": "px"
        }
      },
      "16": {
        "$type": "dimension",
        "$value": {
          "value": 64,
          "unit": "px"
        }
      },
      "20": {
        "$type": "dimension",
        "$value": {
          "value": 80,
          "unit": "px"
        }
      },
      "24": {
        "$type": "dimension",
        "$value": {
          "value": 96,
          "unit": "px"
        }
      },
      "32": {
        "$type": "dimension",
        "$value": {
          "value": 128,
          "unit": "px"
        }
      },
      "optical-2": {
        "$type": "dimension",
        "$value": {
          "value": 2,
          "unit": "px"
        }
      },
      "optical-6": {
        "$type": "dimension",
        "$value": {
          "value": 6,